1833,1834,30347619,祁洁萍,淳厚基金,"淳厚中短债债券A,淳厚中短债债券C,淳厚益加债券A,淳厚益加债券C,淳厚安心87个月定开债,淳厚稳宁6个月定开债,淳厚稳丰债券A,淳厚稳丰债券C,淳厚中证同业存单AAA指数7天持有,淳厚中债1-3年政金债指数,淳厚优加一年持有混合A,淳厚优加一年持有混合C",2713,128.53,14.33
1834,1835,30538860,乔嘉麒,永赢基金,"永赢双利债券A,永赢双利债券C,永赢丰益债券,永赢丰利债券A,永赢丰利债券C,永赢荣益债券A,永赢荣益债券C,永赢泰益债券A,永赢泰益债券C,永赢嘉益债券,永赢裕益债券A,永赢裕益债券C,永赢稳健增长一年持有混合A,永赢稳健增长一年持有混合E",2450,188.64,28.42
1835,1836,30806827,邱家庆,安信基金,"安信稳健阿尔法定开混合A,安信稳健阿尔法定开混合C",150,0.54,-0.06
1836,1837,30533599,乔亮,万家基金,"万家沪深300指数增强A,万家沪深300指数增强C,万家家瑞债券A,万家家瑞债券C,万家量化睿选混合A,万家中证1000指数增强A,万家中证1000指数增强C,万家中证500指数增强A,万家中证500指数增强C,万家创业板指数增强A,万家创业板指数增强C,万家元贞量化选股股票A,万家元贞量化选股股票C,万家量化睿选混合C,万家国证2000指数增强A,万家国证2000指数增强C,万家颐达灵活配置混合C,万家颐达灵活配置混合A",1633,167.25,40.8
1837,1838,30792476,邱林晶,摩根资产管理,"摩根天添盈货币A,摩根天添盈货币B,摩根天添盈货币E,摩根天添盈货币C,摩根中证同业存单AAA指数7天持有期",308,137.49,1.71
1838,1839,30739734,钱玲玲,上海海通证券资产管理,"海通品质升级一年持有混合A,海通品质升级一年持有混合C",760,0.82,-31.61
1839,1840,30800138,渠淼,东海基金,"东海祥泰三年定开债发起式,东海鑫享66个月定开,东海鑫宁利率债三个月定开债",228,160.68,2.96
1840,1841,30724585,齐宁,博时基金,"博时创新驱动混合A,博时创新驱动混合C",1106,0.35,-52.29
1841,1842,30755595,邱楠宇,宏利基金,"宏利稳定混合,宏利品质生活混合",772,2.18,-31.36
1842,1843,30063126,乔培涛,方正富邦基金,"方正富邦新兴成长混合A,方正富邦新兴成长混合C,方正富邦金立方一年持有期混合A,方正富邦金立方一年持有期混合D,方正富邦金立方一年持有期混合E",2389,7.96,-13.43
1843,1844,30429460,秦庆,申万宏源证券资产管理,"申万红利成长灵活配置混合,申万宏源双季增享6个月债券A,申万宏源双季增享6个月债券B,申万宏源双季增享6个月债券C",1116,4.76,3.3
1844,1845,30544882,乔迁,兴证全球基金,"兴全新视野定开混合,兴全合丰三年持有混合,兴全商业模式优选混合",2402,247.87,84.66
1845,1846,30814786,祁庆,浦银安盛基金,"浦银季季盈90天滚动持有中短债A,浦银季季盈90天滚动持有中短债C,浦银安盛普兴3个月定开债券",36,40.84,0.42
1846,1847,30081177,裘倩倩,华安基金,"华安新兴消费混合A,华安新兴消费混合C",683,21.93,-19.38
1847,1848,30043115,钱睿南,兴业基金,"兴业兴睿两年持有混合A,兴业兴睿两年持有混合C,兴业均衡优选混合A,兴业均衡优选混合C",5542,56.31,-8.24
1848,1849,30728868,祁善斌,国寿安保基金,"国寿安保成长优选股票A,国寿安保研究精选混合A,国寿安保研究精选混合C,国寿安保成长优选股票C",1033,15.06,-30.02
1849,1850,30283501,钱思佳,泉果基金,"泉果嘉源三年持有期混合A,泉果嘉源三年持有期混合C",1188,7.45,0.14
1850,1851,30659220,曲少杰,长城基金,"长城港股通价值精选混合A,长城港股通价值精选混合C,长城全球新能源车股票发起式(QDII)C,长城全球新能源车股票发起式(QDII)A",1689,0.83,20.8
1851,1852,30200584,邱世磊,广发基金,"广发安悦回报混合A,广发稳裕混合A,广发集瑞债券A,广发集瑞债券C,广发安悦回报混合C,广发稳裕混合C,广发恒祥债券A,广发恒祥债券C,广发恒裕一年持有期混合A,广发恒裕一年持有期混合C",2798,8.98,2.97
1852,1853,30563666,曲盛伟,嘉实基金,"嘉实逆向策略股票,嘉实策略精选混合A,嘉实策略精选混合C,嘉实多元动力混合A,嘉实多元动力混合C,嘉实主题新动力混合",2250,23.31,36.33
1853,1854,30760932,祁滕,恒生前海基金,"恒生沪港深新兴产业精选混合,恒生前海高端制造混合A,恒生前海高端制造混合C",687,0.45,-41.96
1854,1855,30804275,邱天,天风(上海)证券资产管理,天风天盈一年定开混合,183,0.54,-18.2
1855,1856,30810065,钱韬,上海海通证券资产管理,"海通鑫选三个月持有债券A,海通鑫选三个月持有债券C,海通鑫悦债券C,海通鑫悦债券A",100,1.29,-0.18
1856,1857,30722034,秦闻,浦银安盛基金,"浦银安盛科技创新优选混合,浦银安盛睿智精选混合A,浦银安盛睿智精选混合C",1136,0.73,-32.91
1857,1858,30285654,钱文成,国联基金,"国联品牌优选混合A,国联品牌优选混合C,国联融慧双欣一年定开债券A,国联融慧双欣一年定开债券C,国联景颐6个月持有混合A,国联景颐6个月持有混合C,国联景泓一年持有混合A,国联景泓一年持有混合C,国联兴鸿优选混合A,国联兴鸿优选混合C",3903,7.81,6.5
1858,1859,30050273,钱伟华,富国基金,"富国元利债券A,富国元利债券C",619,3.7,0.9
1859,1860,30131622,钱文礼,长盛基金,"长盛成长精选混合A,长盛成长精选混合C,长盛成长龙头混合A,长盛成长龙头混合C,长盛同智优势混合(LOF)",2296,4.6,-30.5
1860,1861,30691494,齐炜中,大成基金,"大成一带一路灵活配置混合A,大成消费机遇混合A,大成消费机遇混合C,大成新兴活力混合A,大成新兴活力混合C,大成至诚鑫选混合A,大成至诚鑫选混合C,大成景阳领先混合C,大成消费主题混合C,大成蓝筹稳健混合C,大成一带一路灵活配置混合C,大成蓝筹稳健混合A,大成消费主题混合A,大成景阳领先混合A",1467,47.77,65.17
1861,1862,30719509,钱鑫,兴证全球基金,兴全有机增长混合,1157,15.22,-36.02
1862,1863,30728392,齐兴方,信达澳亚基金,"信澳先进智造股票型,信澳领先增长混合C,信澳领先增长混合A",1039,25.11,-40.09
1863,1864,30794135,邱小乐,融通基金,"融通中国概念债券(QDII)A,融通中国概念债券(QDII)C",289,0.44,2.36
1864,1865,30422170,秦绪文,东方红资产管理,"东方红睿元混合,东方红沪港深混合,东方红智选三年持有混合A,东方红智选三年持有混合C,东方红睿阳三年混合",2940,68.37,44.05
1865,1866,30775946,邱晓旭,国泰基金,"国泰价值先锋股票A,国泰价值先锋股票C,国泰产业精选一年封闭运作混合C,国泰产业精选一年封闭运作混合A,国泰创新医疗混合发起A,国泰创新医疗混合发起C",542,14.4,-19.5
1866,1867,30198132,曲扬,前海开源基金,"前海开源国家比较优势混合A,前海开源中国稀缺资产混合A,前海开源沪港深蓝筹精选混合A,前海开源沪港深价值精选混合,前海开源沪港深优势精选混合A,前海开源人工智能主题混合,前海开源中国稀缺资产混合C,前海开源优质企业6个月持有混合A,前海开源优质企业6个月持有混合C,前海开源国家比较优势混合C,前海开源沪港深优势精选混合C,前海开源沪港深蓝筹精选混合C,前海开源聚利一年持有混合A,前海开源聚利一年持有混合C",3738,187.8,129.17
1867,1868,30342432,秦毅,泓德基金,"泓德远见回报混合,泓德战略转型股票,泓德泓华混合,泓德臻远回报混合,泓德睿泽混合,泓德睿源三年持有期混合,泓德睿诚混合A,泓德睿诚混合C",2443,167.94,119.19
1868,1869,30679166,戚彧,长江证券(上海)资管,"长江安盈中短债六个月定开A,长江致惠30天滚动持有短债发起A,长江致惠30天滚动持有短债发起C,长江聚利债券型C,长江惠盈9个月持有债券发起式A,长江惠盈9个月持有债券发起式C,长江楚财一年持有期混合发起A,长江楚财一年持有期混合发起C,长江安盈中短债六个月定开C,长江聚利债券型A",1039,19.32,10.22
1869,1870,30704737,邱延冰,中金基金,"中金衡优灵活配置混合A,中金衡优灵活配置混合C,中金瑞和A,中金瑞和C,中金鑫瑞优选一年持有混合",1317,2.28,-18.86
1870,1871,30361764,钱亚风云,中欧基金,"中欧悦享生活混合A,中欧悦享生活混合C,中欧行业景气一年持有混合A,中欧行业景气一年持有混合C,中欧行业鑫选混合A,中欧行业鑫选混合C,中欧聚优港股通混合发起A,中欧聚优港股通混合发起C,中欧致和混合A,中欧致和混合C",2876,29.52,-14.09
1871,1872,30079449,邱宇航,建信基金,"建信消费升级混合,建信汇利灵活配置混合",4596,1.04,100.8
1872,1873,30749750,钱亚婷,中欧基金,"中欧互通精选混合E,中欧瑾灵灵活配置混合A,中欧瑾灵灵活配置混合C,中欧周期景气混合发起A,中欧周期景气混合发起C,中欧量化先锋混合A,中欧量化先锋混合C,中欧沪深300指数增强A,中欧沪深300指数增强C,中欧中证500指数增强A,中欧中证500指数增强C,中欧小盘成长混合A,中欧小盘成长混合C,中欧中证1000指数增强A,中欧中证1000指数增强C,中欧国证2000指数增强A,中欧国证2000指数增强C,中欧沪深300指数增强E,中欧中证500指数增强E,中欧半导体产业股票发起A,中欧半导体产业股票发起C,中欧互通精选混合A",828,34.17,-4.45
1873,1874,30789515,齐震,华宝基金,"华宝大健康混合A,华宝大健康混合C",346,0.98,-16.76
1874,1875,30775179,钦振浩,浙商基金,浙商智配瑞享一年持有债券(FOF),56,0.86,0.26
1875,1876,30493964,漆志伟,长江证券(上海)资管,"长江收益增强债券,长江乐盈定开债发起式,长江乐鑫定开债,长江可转债债券A,长江可转债债券C,长江安盈中短债六个月定开A,长江添利混合A,长江添利混合C,长江安享纯债18个月定开债A,长江安享纯债18个月定开债C,长江双盈6个月持有债券发起式A,长江双盈6个月持有债券发起式C,长江致惠30天滚动持有短债发起A,长江致惠30天滚动持有短债发起C,长江丰瑞3个月持有期债券A,长江丰瑞3个月持有期债券C,长江安盈中短债六个月定开C",2671,47.82,36.95
1876,1877,30285153,芮晨,交银施罗德基金,"交银科技创新灵活配置混合C,交银启衡混合A,交银启衡混合C,交银科技创新灵活配置混合A",3189,5.46,93.17
1877,1878,30429665,任翀,泰康基金,"泰康安泰回报混合,泰康安益纯债A,泰康安益纯债C,泰康安惠纯债债券A,泰康安悦纯债3月定开债券,泰康裕泰债券A,泰康裕泰债券C,泰康安惠纯债债券C,泰康悦享90天持有期债券A,泰康悦享90天持有期债券C",2879,101.55,46.12
1878,1879,30077841,芮定坤,民生加银基金,"民生加银周期优选混合A,民生加银周期优选混合C,民生加银品牌蓝筹混合C,民生加银品牌蓝筹混合A",795,2.19,-16.23
1879,1880,30810112,任飞,中欧基金,"中欧周期优选混合发起A,中欧周期优选混合发起C",87,0.11,-1.55
1880,1881,30040345,饶刚,睿远基金,"睿远稳进配置两年持有混合A,睿远稳进配置两年持有混合C",5831,90.54,-7.05
1881,1882,30775655,阮航,前海联合,"前海联合泳辉纯债A,前海联合泳辉纯债C",546,2.3,5.46
1882,1883,30403971,任慧娟,泰康基金,"泰康新机遇混合,泰康恒泰回报混合A,泰康恒泰回报混合C,泰康丰盈债券A,泰康现金管家货币A,泰康现金管家货币B,泰康现金管家货币C,泰康现金管家货币D,泰康申润一年持有期混合A,泰康申润一年持有期混合C,泰康丰盛纯债一年定开发起,泰康丰泰一年定开债券发起,泰康丰盈债券C",2984,142.9,44.34
1883,1884,30782584,任婧,南方基金,"南方兴盛先锋灵活配置混合A,南方兴盛先锋灵活配置混合C",448,6.06,-1.04
1884,1885,30132083,冉凌浩,大成基金,"大成纳斯达克100ETF联接(QDII)A,大成标普500等权重指数(QDII)C人民币,大成纳斯达克100ETF联接(QDII)C,大成中华沪深港300指数(LOF)C,大成恒生科技ETF发起式联接A,大成恒生科技ETF发起式联接C,大成标普500等权重指数(QDII)A美元,大成标普500等权重指数(QDII)C美元,大成恒生指数(QDII-LOF)C,大成标普500等权重指数(QDII)A人民币,大成纳斯达克100ETF(QDII),大成恒生科技ETF(QDII),大成恒生指数(QDII-LOF)A,大成中华沪深港300指数(LOF)A",4550,95.06,323.9
1885,1886,30062904,任琳娜,招商基金,"招商安润灵活配置混合A,招商能源转型混合A,招商能源转型混合C,招商安润灵活配置混合C,招商碳中和主题混合A,招商碳中和主题混合C",2070,9.04,-42.26
1886,1887,30744390,任明,天弘基金,"天弘通利混合A,天弘新活力混合发起A,天弘荣享定开债,天弘中债1-3年国开债发起A,天弘宁弘六个月A,天弘宁弘六个月C,天弘安盈一年持有A,天弘安盈一年持有C,天弘永利优佳混合A,天弘永利优佳混合C,天弘中债1-3年国开债发起C,天弘通利混合C,天弘新活力混合发起C",874,181.12,8.54
1887,1888,30767677,任宁钦,红土创新基金,红土深圳安居REIT,536,12.49,
1888,1889,30587927,任凭,安信基金,"安信现金增利货币A,安信活期宝货币A,安信现金增利货币B,安信活期宝货币B,安信鑫日享中短债A,安信鑫日享中短债C,安信宏盈18个月持有混合,安信中证同业存单AAA指数7天持有,安信活期宝货币C,安信现金增利货币C,安信现金管理货币A,安信现金管理货币B",2009,257.01,14.66
1889,1890,30758350,任祺,东兴基金,"东兴兴财短债债券A,东兴兴财短债债券C,东兴鑫远三年定开,东兴兴盈三个月定开债A,东兴兴盈三个月定开债C",731,85.21,5.31
1890,1891,30711025,饶琦,粤开证券,粤开现金惠货币,466,3.26,1.72
1891,1892,30106034,任爽,广发基金,"广发天天红货币A,广发天天利货币A,广发天天利货币B,广发钱袋子货币A,广发活期宝货币A,广发天天利货币E,广发天天红货币B,广发活期宝货币B,广发钱袋子货币E,广发活期宝货币C,广发活期宝货币D",4076,4649.49,35.76
1892,1893,30726099,任涛,融通基金,"融通新能源灵活配置混合A,融通新能源灵活配置混合C",1072,3.87,-29.14
1893,1894,30675229,任翔,摩根资产管理,"摩根瑞益纯债债券A,摩根瑞益纯债债券C,摩根瑞泰38个月定期开放债券A,摩根瑞泰38个月定期开放债券C,摩根月月盈30天滚动持有发起式短债债券A,摩根月月盈30天滚动持有发起式短债债券C",1536,85.08,12.45
1894,1895,30325149,任相栋,兴证全球基金,"兴全合泰混合A,兴全合泰混合C,兴证全球合衡三年持有混合A,兴证全球合衡三年持有混合C",2825,108.44,8.74
1895,1896,30276715,饶晓鹏,华安基金,"华安汇智精选两年持有期混合,华安聚优精选混合,华安聚弘精选混合A,华安聚弘精选混合C,华安升级主题混合C,华安行业轮动混合,华安升级主题混合A",3549,73.01,124.88
1896,1897,30387787,荣膺,华夏基金,"华夏中证500ETF联接A,华夏中证500ETF联接C,华夏AH经济蓝筹股票A,华夏AH经济蓝筹股票C,华夏黄金ETF联接A,华夏黄金ETF联接C,华夏科创50ETF联接A,华夏科创50ETF联接C,华夏MSCI中国A50互联互通ETF发起式联接A,华夏MSCI中国A50互联互通ETF发起式联接C,华夏上证科创板50成份指数增强发起式A,华夏上证科创板50成份指数增强发起式C,华夏中证智选500价值稳健策略ETF发起式联接A,华夏中证智选500价值稳健策略ETF发起式联接C,华夏上证科创板100ETF联接A,华夏上证科创板100ETF联接C,华夏MSCI中国A50互联互通ETF,华夏中证智选500价值稳健策略ETF,华夏中证智选500成长创新策略ETF,华夏创业板价值ETF,华夏创成长ETF,华夏饲料豆粕期货ETF,华夏中证500ETF,华夏中证央企ETF,华夏黄金ETF,华夏上证科创板50成份ETF,华夏上证科创板100ETF",3017,1328.82,96.31
1897,1898,30608989,阮毅,平安证券,"平安安赢添利半年滚动持有A,平安安赢添利半年滚动持有B,平安安赢添利半年滚动持有C,平安安赢添利半年滚动持有D,平安现金宝现金管理",1258,148.58,0.88
1898,1899,30813793,饶于晨,上海光大证券资产管理,"光大阳光智造混合A,光大阳光智造混合B,光大阳光智造混合C",44,2.38,-8.37
1899,1900,30367885,饶玉涵,国泰基金,国泰金鼎价值混合,3075,4.87,-23.46
1900,1901,30535656,茹奕菡,汇添富基金,"汇添富安心中国债券A,汇添富安心中国债券C",1956,0.99,14.89
1901,1902,30733100,冉宇航,广发基金,"广发金融地产精选股票A,广发金融地产精选股票C",955,0.69,-33.72
1902,1903,30687146,戎逸洲,东方红资产管理,"东方红中证竞争力指数A,东方红中证竞争力指数C,东方红中证优势成长指数发起A,东方红中证优势成长指数发起C",1533,5.17,-2.09
1903,1904,30807432,任峥,万家基金,"万家优选积极三个月持有期混合发起式(FOF)A,万家优选积极三个月持有期混合发起式(FOF)C",83,0.1,-14.81
1904,1905,30790753,容志能,宝盈基金,"宝盈转型动力混合A,宝盈国家安全沪港深股票A,宝盈创新驱动股票A,宝盈创新驱动股票C,宝盈国家安全沪港深股票C,宝盈转型动力混合C",329,17.38,-5.61
1905,1906,30080853,神爱前,平安基金,"平安转型创新混合A,平安转型创新混合C,平安品质优选混合A,平安品质优选混合C,平安兴奕成长1年持有混合A,平安兴奕成长1年持有混合C,平安策略优选1年持有混合A,平安策略优选1年持有混合C,平安策略回报混合A,平安策略回报混合C,平安策略先锋混合",2761,61.01,96.71
1906,1907,30038974,史博,南方基金,"南方绩优成长混合C,南方兴润价值一年持有混合A,南方兴润价值一年持有混合C,南方新能源产业趋势混合A,南方新能源产业趋势混合C,南方港股创新视野一年持有混合A,南方港股创新视野一年持有混合C,南方绩优成长混合A,南方瑞合定开混合(LOF)",5749,110.76,130.91
1907,1908,30671593,孙彬,富国基金,"富国价值优势混合,富国新机遇灵活配置混合A,富国新机遇灵活配置混合C,富国融享18个月定开混合A,富国融泰三个月定开混合发起式,富国沪深300基本面精选股票A,富国沪深300基本面精选股票C,富国红利混合A,富国红利混合C,富国融享18个月定开混合C,富国融丰两年定期开放混合A,富国融丰两年定期开放混合C,富国上证50基本面精选股票发起式A,富国上证50基本面精选股票发起式C,富国周期精选三年持有期混合A,富国周期精选三年持有期混合C,富国核心优势混合发起式A,富国核心优势混合发起式C",1723,100.4,87.17
1908,1909,30760136,孙博斐,鹏华基金,"鹏华养老2035三年持有混合(FOF)A,鹏华养老2045三年持有混合发起式(FOF)A,鹏华长乐稳健养老混合发起式(FOF)A,鹏华精选群英一年持有混合MOM,鹏华长治稳健养老一年持有期混合(FOF)A,鹏华养老2040五年持有混合发起式(FOF),鹏华长治稳健养老一年持有期混合(FOF)Y,鹏华长乐稳健养老混合发起式(FOF)Y,鹏华养老2035三年持有混合(FOF)Y,鹏华养老2045三年持有混合发起式(FOF)Y",643,6.89,-9.8
1909,1910,30752172,史宝珖,工银瑞信基金,"工银湾创100ETF联接A,工银湾创100ETF联接C,工银沪港深互联网ETF发起式联接A,工银沪港深互联网ETF发起式联接C,工银中证创新药产业ETF发起式联接A,工银中证创新药产业ETF发起式联接C,工银中证稀有金属主题ETF发起式联接A,工银中证稀有金属主题ETF发起式联接C,工银中证消费龙头ETF,工银瑞信国证半导体芯片ETF,工银瑞信中证稀有金属主题ETF,工银瑞信中证港股通高股息精选ETF,工银瑞信中证线上消费ETF,工银瑞信中证沪港深互联网ETF,工银粤港澳大湾区创新100ETF,工银瑞信中证创新药产业ETF,工银中证100ETF,工银瑞信中证国新央企现代能源ETF",800,30.63,0.51
1910,1911,30778571,宋宾煌,格林基金,"格林伯锐灵活配置A,格林伯锐灵活配置C",506,0.16,-2.29
1911,1912,30069921,孙蓓琳,银华基金,"银华聚利灵活配置混合A,银华大数据灵活配置定开混合,银华聚利灵活配置混合C,银华积极成长混合A,银华积极精选混合,银华积极成长混合C",4067,10.26,47.53
1912,1913,30769285,单柏霖,汇安基金,"汇安成长优选混合A,汇安成长优选混合C,汇安趋势动力股票A,汇安趋势动力股票C",604,0.7,-34.41
1913,1914,30811020,宋伯龙,华夏基金,"华夏优势精选股票,华夏见龙精选混合",85,2.97,-9.45
1914,1915,30133215,宋炳珅,工银瑞信基金,工银研究精选股票,4378,1.31,159.6
1915,1916,30584181,沈博文,广发基金,"广发亚太中高收益债(QDII)A,广发亚太中高收益债美元现汇(QDII)A,广发亚太中高收益债(QDII)C,广发亚太中高收益债美元现汇(QDII)C,广发全球稳健配置混合(QDII)人民币A,广发全球稳健配置混合(QDII)人民币C,广发全球稳健配置混合(QDII)美元A,广发全球稳健配置混合(QDII)美元C",1805,6.5,1.76
1916,1917,30158275,苏秉毅,大成基金,"大成景恒混合C,大成丰享回报混合A,大成丰享回报混合C,大成卓享一年持有混合A,大成卓享一年持有混合C,大成中证1000指数增强发起式A,大成中证1000指数增强发起式C,大成核心双动力混合C,大成核心双动力混合A,大成景恒混合A",4383,39.2,68.24
1917,1918,30138815,沙川,天弘基金,"天弘中证食品饮料ETF联接A,天弘中证食品饮料ETF联接C,天弘中证全指证券公司ETF联接A,天弘中证全指证券公司ETF联接C,天弘中证农业主题A,天弘中证农业主题C,天弘国证A50指数A,天弘国证A50指数C,天弘国证生物医药ETF发起式联接A,天弘国证生物医药ETF发起式联接C,天弘中证全指医疗保健设备与服务ETF联接A,天弘中证全指医疗保健设备与服务ETF联接C,天弘国证龙头家电指数A,天弘国证龙头家电指数C,天弘新华沪港深新兴消费品牌指数A,天弘新华沪港深新兴消费品牌指数C,天弘上海金ETF发起联接A,天弘上海金ETF发起联接C,天弘中证食品饮料ETF,天弘上海金ETF,天弘中证全指证券公司ETF,天弘国证生物医药ETF,天弘中证全指医疗保健设备与服务ETF,天弘中证沪港深线上消费主题ETF",2161,225.35,23.34
1918,1919,30659397,施成,国投瑞银基金,"国投瑞银进宝灵活配置混合,国投瑞银先进制造混合,国投瑞银新能源混合A,国投瑞银新能源混合C,国投瑞银产业趋势混合A,国投瑞银产业趋势混合C,国投瑞银产业升级两年持有混合A,国投瑞银产业升级两年持有混合C,国投瑞银产业转型一年持有混合A,国投瑞银产业转型一年持有混合C,国投瑞银景气驱动混合A,国投瑞银景气驱动混合C",1778,134.09,79.33
1919,1920,30755594,沈成,华富基金,"华富科技动能混合A,华富新能源股票型发起式A,华富新能源股票型发起式C,华富科技动能混合C",772,4.93,-33.76
1920,1921,30081396,苏超,招商基金,"招商品质发现混合A,招商品质发现混合C",76,4.55,-8.01
1921,1922,30815270,邵闯,太平基金,"太平睿安混合A,太平睿安混合C",29,3.05,-5.91
1922,1923,30809691,商昌层,金元顺安基金,金元顺安宝石动力混合,105,0.47,-6.4
1923,1924,30199901,苏昌景,泓德基金,"泓德泓益量化混合,泓德量化精选混合,泓德优质治理灵活配置混合,泓德汽车产业升级混合发起式A,泓德汽车产业升级混合发起式C,泓德高端装备混合发起式A,泓德高端装备混合发起式C,泓德数字经济混合发起式A,泓德数字经济混合发起式C,泓德智选启元混合A,泓德智选启元混合C",2842,12.09,41.14
1924,1925,30791240,孙辰阳,东财基金,"东财远见成长混合发起式A,东财远见成长混合发起式C,东财景气成长混合发起式A,东财景气成长混合发起式C,东财卓越成长混合发起式A,东财卓越成长混合发起式C",304,0.29,0.01
1925,1926,30812468,孙辰旸,富安达基金,"富安达中证同业存单AAA指数7天持有期,富安达现金通货币A,富安达现金通货币B",63,38.77,0.41
1926,1927,30302420,邵笛,东吴基金,"东吴优益债券A,东吴优益债券C,东吴悦秀纯债债券A,东吴悦秀纯债债券C,东吴鼎泰纯债债券A,东吴瑞盈63个月定开债,东吴鼎泰纯债债券C,东吴添利三个月定开债券A,东吴添利三个月定开债券C,东吴添瑞三个月定开债券A,东吴添瑞三个月定开债券C,东吴货币C,东吴货币A,东吴货币B",3389,86.21,28.75
1927,1928,30456071,孙迪,广发基金,"广发品牌消费股票发起式A,广发资源优选股票A,广发资源优选股票C,广发品牌消费股票发起式C,广发先进制造股票发起式A,广发先进制造股票发起式C",2248,11.82,42.31
1928,1929,30532044,孙丹,大成基金,"大成景兴信用债债券A,大成景兴信用债债券C,大成景尚灵活配置混合A,大成景尚灵活配置混合C,大成丰享回报混合A,大成丰享回报混合C,大成卓享一年持有混合A,大成卓享一年持有混合C,大成安享得利六月持有混合A,大成安享得利六月持有混合C,大成民享安盈一年持有混合A,大成民享安盈一年持有混合C,大成盛享一年持有混合A,大成盛享一年持有混合C,大成2020生命周期混合C,大成元丰多利债券A,大成元丰多利债券C,大成2020生命周期混合A",2468,52.92,41.05
1929,1930,30796998,孙丹,汇添富基金,"汇添富双享增利债券A,汇添富双享增利债券C",234,2.74,-0.34
