920,921,30584034,江勇,海富通基金,"海富通策略收益债券A,海富通策略收益债券C,海富通欣睿混合A,海富通欣睿混合C,海富通欣利混合A,海富通欣利混合C,海富通稳固收益债券A,海富通添利收益一年持有期债券A,海富通添利收益一年持有期债券C,海富通欣盈6个月持有期混合A,海富通欣盈6个月持有期混合C,海富通悦享一年持有期混合A,海富通悦享一年持有期混合C,海富通强化回报混合,海富通稳固收益债券C",2040,44.82,10.54
921,922,30565214,金耀,博时基金,"博时产业精选混合A,博时产业精选混合C",1993,4.48,-17.16
922,923,30720444,姜英,国泰基金,"国泰中小盘成长混合(LOF),国泰科创板两年定期开放混合",1148,7.31,-27.71
923,924,30772390,季宇,泓德基金,"泓德泓富混合A,泓德泓富混合C,泓德丰泽混合(LOF)",588,3.38,-15.51
924,925,30778251,姜月,建信基金,"建信安心回报债券A,建信安心回报债券C,建信睿享纯债债券A,建信利率债策略纯债债券A,建信利率债策略纯债债券C,建信睿享纯债债券C,建信利率债债券",514,49.7,3.31
925,926,30783065,江源,建信基金,"建信鑫安回报灵活配置混合A,建信鑫安回报灵活配置混合C",441,3.5,-14.94
926,927,30790819,焦阳,广发资产管理,"广发资管盛世精选混合A,广发资管盛世精选混合,广发资管盛世精选混合C",326,1.38,-13.69
927,928,30794387,姜瑛,益民基金,益民红利成长混合,289,3.01,-24.15
928,929,30804030,金御,财通资管,"财通资管丰和两年定开债A,财通资管丰和两年定开债C,财通资管丰乾39个月定开债A,财通资管丰乾39个月定开债C,财通资管睿慧1年定开债",189,180.36,1.79
929,930,30774539,蒋翼超,华安基金,华安张江光大REIT,564,28.65,
930,931,30724744,江映德,建信基金,"建信裕利灵活配置混合,建信弘利灵活配置混合A,建信弘利灵活配置混合C,建信电子行业股票A,建信电子行业股票C,建信新材料精选股票发起A,建信新材料精选股票发起C,建信优享科技创新混合(LOF)",1103,4.56,-8.85
931,932,30664268,姜永明,财通资管,"财通资管价值成长混合A,财通资管价值成长混合C,财通资管价值发现混合A,财通资管科技创新一年定开混合,财通资管均衡价值一年持有期混合,财通资管价值精选一年持有混合A,财通资管价值精选一年持有混合C,财通资管宸瑞一年持有混合A,财通资管宸瑞一年持有混合C,财通资管价值发现混合C",1758,61.44,55.14
932,933,30769492,贾玉淼,天风(上海)证券资产管理,天风天盈一年定开混合,295,0.54,-23.26
933,934,30383521,蒋一茜,嘉实基金,"嘉实全球房地产(QDII),嘉实原油(QDII-LOF)",3030,1.09,41.39
934,935,30780418,姜玉雯,嘉实基金,"嘉实领航聚优积极配置6个月持有混合(FOF)A,嘉实领航聚优积极配置6个月持有混合(FOF)C,嘉实领航聚利稳健配置6个月持有混合发起(FOF)",469,1.53,-0.75
935,936,30749860,贾雨璇,国融基金,"国融融银灵活配置混合A,国融融银灵活配置混合C,国融融泰灵活配置混合A,国融融泰灵活配置混合C,国融融兴混合A,国融融兴混合C,国融添益增强债券A,国融添益增强债券C",827,10.94,3.0
936,937,30753606,江逸舟,东吴证券,"东吴安鑫中短债A,东吴安鑫中短债B,东吴安鑫中短债C,东吴裕丰6个月持有债券A,东吴裕丰6个月持有债券C",781,1.63,5.73
937,938,30780206,蒋严泽,建信基金,建信恒久价值混合,483,7.55,-33.82
938,939,30304626,金梓才,财通基金,"财通成长优选混合,财通集成电路产业股票A,财通集成电路产业股票C,财通碳中和一年持有混合A,财通碳中和一年持有混合C,财通智慧成长混合A,财通智慧成长混合C,财通匠心优选一年持有混合A,财通匠心优选一年持有混合C,财通景气甄选一年持有期混合A,财通景气甄选一年持有期混合C,财通多策略福鑫定开混合,财通价值动量混合",3369,42.96,213.11
939,940,30697930,金之洁,蜂巢基金,"蜂巢添跃66个月定开债,蜂巢添益纯债A,蜂巢添益纯债C,蜂巢丰业一年定开债发起式,蜂巢添元纯债A,蜂巢添元纯债C,蜂巢添禧87个月定开,蜂巢丰华债券A,蜂巢丰华债券C,蜂巢丰吉纯债A,蜂巢丰吉纯债C,蜂巢添益纯债E,蜂巢上清所0-3年政金债指数A,蜂巢上清所0-3年政金债指数C,蜂巢丰吉纯债E",1381,296.66,15.65
940,941,30780686,蒋正山,湘财基金,"湘财长弘灵活配置混合A,湘财长弘灵活配置混合C",477,1.21,-19.63
941,942,30774121,金泽宇,富国基金,"富国中证1000ETF联接A,富国中证1000ETF联接C,富国创业板中盘200ETF发起式联接A,富国创业板中盘200ETF发起式联接C,富国中证红利低波动ETF,富国创业板中盘200ETF,富国中证1000ETF,富国中证2000ETF",562,58.18,0.0
942,943,30776314,金振振,中邮基金,"中邮未来成长混合A,中邮未来成长混合C",536,6.05,-0.82
943,944,30799403,寇斌权,鹏华基金,"鹏华弘华混合A,鹏华弘华混合C,鹏华弘实混合A,鹏华弘实混合C,鹏华弘达混合A,鹏华弘达混合C,鹏华畅享债券A,鹏华畅享债券C,鹏华中证1000增强ETF",233,1.87,0.51
944,945,30788966,况冲,招商基金,"招商丰利灵活配置混合A,招商丰利灵活配置混合C,招商安瑞进取债券C,招商安瑞进取债券A",358,4.31,-13.18
945,946,30796621,亢豆,建信基金,"建信易盛郑商所能源化工期货ETF联接A,建信易盛郑商所能源化工期货ETF联接C,建信易盛能源化工期货ETF",266,5.98,12.91
946,947,30752767,康冬,南华基金,"南华中证杭州湾区ETF联接A,南华中证杭州湾区ETF联接C,南华中证杭州湾区ETF",163,0.53,-19.16
947,948,30734369,孔芳,前海开源基金,"前海开源黄金ETF联接,前海开源黄金ETF",981,1.66,20.78
948,949,30671325,匡恒,财通基金,"财通收益增强债券C,财通安盈混合A,财通安盈混合C,财通安华混合发起A,财通安华混合发起C,财通收益增强债券A",364,7.43,-1.35
949,950,30405173,柯海东,国联基金,"国联竞争优势,国联策略优选混合A,国联策略优选混合C,国联鑫锐精选一年持有混合A,国联鑫锐精选一年持有混合C,国联匠心优选混合A,国联匠心优选混合C,国联消费精选混合A,国联消费精选混合C",2821,21.92,136.84
950,951,30362196,康晶,招商基金,"招商招裕纯债A,招商招裕纯债C,招商添利6个月定开债发起式A,招商添利6个月定开债发起式C,招商添荣3个月定开债A,招商添荣3个月定开债C,招商添泽纯债A,招商添泽纯债C,招商招和39个月定开债,招商招裕纯债D",3110,296.48,21.9
951,952,30288300,康佳燕,富安达基金,"富安达富利纯债A,富安达富利纯债C,富安达稳健配置6个月持有期混合,富安达中证同业存单AAA指数7天持有期,富安达富祥利率债A,富安达富祥利率债C,富安达富禧纯债30天持有债券A,富安达富禧纯债30天持有债券C,富安达睿选增利债券A,富安达睿选增利债券C,富安达现金通货币A,富安达现金通货币B",2056,52.9,7.24
952,953,30655278,阚磊,银华基金,"银华岁丰定期开放债券发起式,银华安盈短债债券A,银华安盈短债债券C,银华安丰中短期政策性金融债债券A,银华汇盈一年持有期混合A,银华汇盈一年持有期混合C,银华招利一年持有期混合A,银华招利一年持有期混合C,银华安盈短债债券D,银华安丰中短期政策性金融债债券D,银华致淳债券,银华晶鑫债券A,银华晶鑫债券C",1625,107.32,1.66
953,954,30719502,孔令兵,工银瑞信基金,"工银沪港深精选混合A,工银沪港深精选混合C,工银全球股票(QDII)美元,工银全球股票(QDII)港币,工银全球股票(QDII)人民币",1159,27.89,-9.43
954,955,30141667,孔令超,东方红资产管理,"东方红稳健精选混合A,东方红稳健精选混合C,东方红睿逸定期开放混合,东方红策略精选混合A,东方红策略精选混合C,东方红汇利债券A,东方红汇利债券C,东方红汇阳债券A,东方红汇阳债券C,东方红汇阳债券Z,东方红配置精选混合A,东方红配置精选混合C,东方红聚利债券A,东方红聚利债券C,东方红创新优选定开混合",2744,203.16,51.32
955,956,30775290,孔令烨,华泰柏瑞基金,"华泰柏瑞量化驱动混合A,华泰柏瑞量化驱动混合C,华泰柏瑞中证2000指数增强A,华泰柏瑞中证2000指数增强C",553,8.41,-6.2
956,957,30572626,孔雀,财达证券,"财达证券稳达中短债A,财达证券稳达中短债C,财达证券稳达三个月滚动持有债券A,财达证券稳达三个月滚动持有债券C",683,5.49,6.83
957,958,30743368,孔思伟,民生加银基金,"民生卓越配置6个月混合(FOF),民生加银稳健配置6个月混合(FOF),民生加银稳健配置9个月持有混合(FOF),民生加银优享6个月定开混合(FOF-LOF)",526,43.67,-5.86
958,959,30723207,孔涛,华安基金,"华安幸福生活混合A,华安幸福生活混合C,华安动力领航混合A,华安动力领航混合C",1124,6.82,-18.52
959,960,30378810,匡伟,兴证资管,"兴证资管金麒麟领先优势一年持有混合A,兴证资管金麒麟领先优势一年持有混合C,兴证资管金麒麟消费升级混合A,兴证资管金麒麟消费升级混合B,兴证资管金麒麟消费升级混合C",1397,6.22,6.04
960,961,30671434,寇文红,国联基金,"国联鑫起点混合A,国联鑫起点混合C",1726,0.55,-31.67
961,962,30783715,况晓,万家基金,"万家优享平衡混合发起式A,万家优享平衡混合发起式C",427,0.34,-12.35
962,963,30131083,孔学兵,金信基金,"金信行业优选混合发起式A,金信稳健策略混合A,金信精选成长混合A,金信精选成长混合C,金信稳健策略混合C,金信行业优选混合发起式C",3779,24.94,-8.63
963,964,30760887,柯贤发,国元证券,"国元元赢六个月定开债,国元元赢30天持有期债券A,国元元赢30天持有期债券C,国元元增利货币",681,24.6,6.43
964,965,30130842,孔祥鹏,金元顺安基金,"金元顺安宝石动力混合,金元顺安成长动力混合,金元顺安价值增长混合",1703,3.3,-24.28
965,966,30541881,孔晓语,兴银基金管理,"兴银鼎新灵活配置混合,兴银丰盈灵活配置A,兴银先锋成长混合A,兴银先锋成长混合C,兴银研究精选股票A,兴银研究精选股票C,兴银丰盈灵活配置C",2088,2.6,39.23
966,967,30672631,孔宪政,诺安基金,"诺安中证500指数增强A,诺安汇利灵活配置混合A,诺安汇利灵活配置混合C,诺安鼎利混合A,诺安鼎利混合C,诺安沪深300指数增强C,诺安中证500指数增强C,诺安沪深300增强D,诺安沪深300指数增强A,诺安多策略混合,诺安双利债券发起",681,34.43,3.43
967,968,30768989,康研,财通资管,"财通资管通达未来6个月持有混合发起(FOF)A,财通资管通达未来6个月持有混合发起(FOF)C,财通资管通达稳健3个月持有债券发起(FOF)A,财通资管通达稳健3个月持有债券发起(FOF)C,财通资管通达稳利3个月持有期债券发起式(FOF)A,财通资管通达稳利3个月持有期债券发起式(FOF)C",582,0.77,5.07
968,969,30726213,康钊,华安基金,"华安鼎丰债券发起式A,华安安盛3个月定开债,华安安业债券A,华安安业债券C,华安安和债券A,华安安和债券C,华安安平6个月定开债,华安领荣一年定开债券发起式,华安鼎丰债券发起式C,华安鼎盈一年定开债发起式",1068,171.68,13.93
969,970,30815912,康子冉,平安基金,"平安鑫安混合A,平安鑫安混合C,平安鑫安混合E,平安灵活配置混合C,平安灵活配置混合A",14,0.65,-1.31
970,971,30810218,李安,汇添富基金,"汇添富稳健收益混合A,汇添富稳健收益混合C,汇添富稳健收益混合B",99,14.65,3.77
971,972,30358533,罗安安,南方基金,"南方新兴龙头灵活配置混合,南方人工智能混合,南方优选价值混合C,南方核心成长混合A,南方核心成长混合C,南方创新精选一年定开混合A,南方创新精选一年定开混合C,南方创新成长混合A,南方创新成长混合C,南方新兴产业混合A,南方新兴产业混合C,南方专精特新混合A,南方专精特新混合C,南方核心科技一年持有混合A,南方核心科技一年持有混合C,南方优选价值混合A,南方优选价值混合H",3136,46.53,82.78
972,973,30671075,刘安坤,融通基金,"融通跨界成长灵活配置混合,融通逆向策略灵活配置混合A,融通产业趋势先锋股票,融通逆向策略灵活配置混合C",1729,1.57,29.29
973,974,30567663,刘爱民,富国基金,"富国短债债券型A,富国短债债券型C,富国安福30天滚动持有短债发起A,富国安福30天滚动持有短债发起C,富国安瑞30天持有期债券发起式A,富国安瑞30天持有期债券发起式C,富国短债债券型D,富国安福30天滚动持有短债债券发起式E,富国安和120天滚动持有债券发起式A,富国安和120天滚动持有债券发起式C",1999,82.75,2.17
974,975,30729620,李安然,西部利得基金,"西部利得聚利6个月定开债A,西部利得聚利6个月定开债C,西部利得聚享一年定开债券A,西部利得聚享一年定开债券C,西部利得沣泰债券A,西部利得聚泰18个月定开债A,西部利得聚泰18个月定开债C,西部利得沣泰债券C,西部利得双兴一年定开债券发起,西部利得聚利6个月定开债券E,西部利得汇享债券A,西部利得汇享债券C",1024,112.11,16.27
975,976,30054615,罗博,银河基金,"银河量化优选混合A,银河量化稳进混合,银河嘉谊灵活配置混合A,银河嘉谊灵活配置混合C,银河沪深300指数增强A,银河沪深300指数增强C,银河沪深300价值指数C,银河量化优选混合C,银河沪深300价值指数A",5156,25.5,79.37
976,977,30054195,刘斌,嘉实基金,"嘉实沪深300指数研究增强A,嘉实量化精选股票,嘉实中证半导体指数增强发起式A,嘉实中证半导体指数增强发起式C,嘉实沪深300指数研究增强C,嘉实低碳精选混合发起式A,嘉实低碳精选混合发起式C,嘉实上证科创板50指数增强发起式A,嘉实上证科创板50指数增强发起式C",4997,47.05,48.87
977,978,30181758,刘彬,广发基金,"广发睿选三年持有期混合,广发成长精选混合A,广发成长精选混合C",1587,36.13,-23.87
978,979,30158836,刘波,国泰基金,"国泰可转债债券,国泰信利三个月定开债,国泰信用互利债券C,国泰鑫享稳健6个月滚动持有债券,国泰鑫享稳健6个月滚动持有债券C,国泰金龙债券A,国泰金龙债券C,国泰信用互利债券A",3664,54.22,11.3
979,980,30201644,腊博,兴业基金,"兴业定开债A,兴业聚盈混合A,兴业聚鑫灵活配置混合A,兴业定开债C,兴业裕恒债券,兴业6个月定开债券,兴业龙腾双益平衡混合,兴业聚鑫灵活配置混合C,兴业稳健双利一年持有期债券A,兴业稳健双利一年持有期债券C,兴业聚申一年持有期混合A,兴业聚申一年持有期混合C,兴业聚乾混合A,兴业聚乾混合C,兴业聚兴混合A,兴业聚兴混合C,兴业聚盈混合C",3660,114.14,66.54
980,981,30336357,李博,大成基金,"大成企业能力驱动混合A,大成企业能力驱动混合C,大成精选增值混合C,大成精选增值混合A",3216,40.16,72.33
981,982,30322942,李博,摩根资产管理,"摩根核心成长股票A,摩根核心精选股票A,摩根行业睿选股票A,摩根行业睿选股票C,摩根核心精选股票C,摩根核心成长股票C,摩根阿尔法混合C,摩根阿尔法混合A",3327,30.76,67.82
982,983,30592132,陆奔,华安基金,"华安新优选灵活配置混合A,华安新优选灵活配置混合C,华安安康灵活配置混合A,华安安康灵活配置混合C,华安睿明两年定开混合A,华安睿明两年定开混合C,华安添瑞6个月混合A,华安添瑞6个月混合C,华安添福18个月混合A,华安添福18个月混合C,华安添利6个月债券A,华安添利6个月债券C,华安添祥6个月持有混合A,华安兴安优选一年持有混合A,华安兴安优选一年持有混合C,华安添祥6个月持有混合C,华安睿信优选混合A,华安睿信优选混合C",1963,120.17,59.2
983,984,30671187,陆彬,汇丰晋信基金,"汇丰晋信智造先锋股票A,汇丰晋信智造先锋股票C,汇丰晋信核心成长A,汇丰晋信核心成长C,汇丰晋信低碳先锋股票C,汇丰晋信研究精选混合,汇丰晋信时代先锋混合A,汇丰晋信时代先锋混合C,汇丰晋信动态策略混合C,汇丰晋信龙腾混合C,汇丰晋信龙腾混合A,汇丰晋信动态策略混合A,汇丰晋信低碳先锋股票A,汇丰晋信动态策略混合H",1728,167.93,108.86
984,985,30673148,李彪,鑫元基金,"鑫元欣享灵活配置混合A,鑫元欣享灵活配置混合C,鑫元安鑫回报混合A,鑫元鑫动力混合A,鑫元鑫动力混合C,鑫元长三角混合A,鑫元长三角混合C,鑫元安鑫回报混合C,鑫元欣悦混合A,鑫元欣悦混合C,鑫元添鑫回报6个月持有期混合A,鑫元添鑫回报6个月持有期混合C,鑫元科技创新混合A,鑫元科技创新混合C",1704,19.97,23.82
985,986,30709106,李彪,汇添富基金,"汇添富养老2040五年持有混合(FOF)A,汇添富养老2050混合(FOF)A,汇添富添福盈和稳健养老一年持有混合(FOF)A,汇添富聚焦经典一年持有混合(FOF)A,汇添富聚焦经典一年持有混合(FOF)C,汇添富优质精选一年持有混合(FOF)A,汇添富优质精选一年持有混合(FOF)C,汇添富经典价值成长一年持有混合(FOF),汇添富均衡增长三个月持有混合(FOF)A,汇添富均衡增长三个月持有混合(FOF)C,汇添富核心优选六个月持有混合(FOF)A,汇添富核心优选六个月持有混合(FOF)C,汇添富积极回报一年持有混合(FOF)A,汇添富积极回报一年持有混合(FOF)C,汇添富养老2050五年持有混合(FOF)Y,汇添富养老2040五年持有混合(FOF)Y,汇添富添福盈和稳健养老一年持有混合(FOF)Y",1291,55.12,-3.22
986,987,30719508,刘波,浙商基金,"浙商兴盈6个月定开债券A,浙商兴盈6个月定开债券C",959,3.02,1.08
987,988,30733054,刘兵,交银施罗德基金,"交银安享稳健养老一年(FOF)A,交银养老2035三年(FOF)A,交银安悦平衡养老三年持有期混合发起(FOF),交银招享一年持有混合(FOF)A,交银招享一年持有混合(FOF)C,交银兴享一年持有期混合(FOF)A,交银兴享一年持有期混合(FOF)C,交银智选星光混合(FOF-LOF)C,交银优享一年持有混合(FOF)A,交银优享一年持有混合(FOF)C,交银慧选睿信一年持有混合(FOF)A,交银慧选睿信一年持有混合(FOF)C,交银养老2035三年(FOF)Y,交银安享稳健养老一年(FOF)Y,交银智选进取三个月持有期混合发起(FOF)A,交银智选进取三个月持有期混合发起(FOF)C,交银智选星光混合(FOF-LOF)A",899,137.22,0.0
988,989,30729367,李博,信达澳亚基金,"信澳星奕混合A,信澳星奕混合C,信澳新能源精选混合A,信澳博见成长一年定期开放混合A,信澳博见成长一年定期开放混合C,信澳新能源精选混合C",990,65.87,-2.64
989,990,30805891,刘斌,国联基金,"国联添益进取3个月持有混合发起(FOF)A,国联添益进取3个月持有混合发起(FOF)C,国联添安稳健养老目标一年持有混合(FOF)A,国联添安稳健养老目标一年持有混合(FOF)Y",165,2.91,0.76
990,991,30810618,李波,中欧基金,"中欧瑾源灵活配置混合A,中欧瑾源灵活配置混合C,中欧真益稳健一年混合A,中欧真益稳健一年混合C,中欧添益一年混合A,中欧添益一年混合C,中欧达益稳健一年混合A,中欧达益稳健一年混合C,中欧融享增益一年持有期混合A,中欧融享增益一年持有期混合C,中欧琪福混合A,中欧琪福混合C,中欧琪福混合E",91,12.65,0.63
991,992,30815923,李斌,鹏扬基金,"鹏扬稳利债券A,鹏扬稳利债券C",15,10.3,0.58
992,993,30757771,刘斌斌,平安基金,"平安恒泽混合A,平安恒泽混合C,平安恒鑫混合A,平安恒鑫混合C",744,1.94,-10.68
993,994,30432539,李邦长,华安基金,"华安汇财通货币,华安现金宝货币A,华安现金宝货币B,华安鼎丰债券发起式A,华安现金润利,华安中证同业存单AAA指数7天持有发起式,华安鼎丰债券发起式C,华安现金富利货币E,华安现金富利货币A,华安日日鑫货币A,华安日日鑫货币B,华安现金富利货币B,华安日日鑫货币H",2900,2646.18,37.98
994,995,30571807,林博程,中银证券,"中银证券价值精选混合,中银证券精选行业股票A,中银证券精选行业股票C,中银证券优势成长混合A,中银证券优势成长混合C,中银证券科技创新混合(LOF)",2000,11.97,-33.67
995,996,30185325,李本刚,华西基金,华西优选价值混合发起,2779,0.21,-14.08
996,997,30201130,李博涵,建信基金,"建信富时100指数(QDII)人民币C,建信富时100指数(QDII)美元现汇A,建信富时100指数(QDII)美元现汇C,建信纳斯达克100指数(QDII)美元现汇A,建信纳斯达克100指数(QDII)人民币C,建信纳斯达克100指数(QDII)美元现汇C,建信新兴市场混合(QDII)C,建信纳斯达克100指数(QDII)人民币A,建信新兴市场混合(QDII)A,建信富时100指数(QDII)人民币A",3840,8.97,57.5
997,998,30814653,李博航,德邦证券资管,"德邦资管月月鑫30天滚动债A,德邦资管月月鑫30天滚动债C",37,5.6,0.41
998,999,30081579,鲁炳良,南方基金,"南方养老2035三年持有混合(FOF)A,南方养老2035三年持有混合(FOF)C,南方养老目标2030三年持有混合发起(FOF)A,南方养老2040三年持有混合发起(FOF)A,南方富祥稳健养老目标一年持有混合(FOF)A,南方浩泰平衡优选一年持有混合(FOF)A,南方浩泰平衡优选一年持有混合(FOF)C,南方养老目标2050五年持有混合(FOF),南方浩祥3个月持有债券发起(FOF),南方富祥稳健养老目标一年持有混合(FOF)Y,南方养老目标2030三年持有混合发起(FOF)Y,南方养老2035三年持有混合(FOF)Y,南方养老2040三年持有混合发起(FOF)Y,南方养老目标2060五年持有混合发起(FOF),南方养老目标2055五年持有混合发起(FOF),南方康乐养老目标日期2045三年持有混合发起(FOF)",1876,24.9,28.9
999,1000,30549685,李博良,华泰证券(上海)资产管理,"华泰紫金智惠定开债券A,华泰紫金智惠定开债券C,华泰紫金智盈债券A,华泰紫金智盈债券C,华泰紫金丰泰纯债发起A,华泰紫金丰泰纯债发起C,华泰紫金月月发1个月滚动债券发起A,华泰紫金月月发1个月滚动债券发起C,华泰紫金智享一年定开债券发起,华泰紫金智和利率债",2360,62.53,30.68
1000,1001,30512489,鲁邦旺,博时基金,"博时岁岁增利一年持有期债券A,博时天天增利货币A,博时天天增利货币B,博时合利货币B,博时景发纯债债券A,博时兴荣货币B,博时合利货币A,博时兴荣货币A,博时月月享30天持有期短债A,博时月月享30天持有期短债C,博时月月乐同业存单30天持有混合,博时保证金货币ETFC,博时岁岁增利一年持有期债券C,博时景发纯债债券C,博时双月乐60天持有期债券A,博时双月乐60天持有期债券C,博时保证金货币ETFA",2612,1029.35,32.47
1001,1002,30467936,李兵伟,东兴基金,"东兴未来价值混合A,东兴未来价值混合C,东兴中证消费50A,东兴中证消费50C,东兴兴晟混合A,东兴兴晟混合C,东兴宸瑞量化混合A,东兴宸瑞量化混合C,东兴宸祥量化混合A,东兴宸祥量化混合C,东兴连众一年持有期混合A,东兴连众一年持有期混合C",2797,7.47,8.6
1002,1003,30775582,李博闻,国寿安保基金,"国寿安保新蓝筹混合,国寿安保高股息混合A,国寿安保高股息混合C",548,2.15,2.45
1003,1004,30519594,李炳智,前海开源基金,"前海开源嘉鑫混合A,前海开源嘉鑫混合C,前海开源鼎瑞债券A,前海开源鼎瑞债券C,前海开源瑞和债券A,前海开源瑞和债券C,前海开源弘泽债券发起式A,前海开源弘泽债券发起式C,前海开源乾利定期开放债券,前海开源1-3年国开债A,前海开源1-3年国开债C,前海开源惠盈39个月定开债券,前海开源丰和债券A,前海开源丰和债券C",2571,153.76,46.99
1004,1005,30743020,梁冰哲,安信基金,"安信新价值混合A,安信新价值混合C,安信永盛定开债券,安信尊享添益债券A,安信聚利增强债券A,安信聚利增强债券C,安信尊享添益债券C,安信聚利增强债券B,安信永盈一年定开债券",893,26.03,10.96
1005,1006,30038091,李琛,广发基金,"广发消费品精选混合C,广发睿鑫混合A,广发睿鑫混合C,广发睿明优质企业混合A,广发睿明优质企业混合C,广发消费品精选混合A",6085,12.88,59.5
1006,1007,30181751,刘晨,中银基金,"中银颐利混合A,中银颐利混合C,中银数字经济混合A,中银数字经济混合C",2264,1.11,-35.29
1007,1008,30184620,林材,前海联合,"前海联合国民健康混合A,前海联合国民健康混合C,前海联合产业趋势混合A,前海联合产业趋势混合C",3689,1.86,24.43
1008,1009,30136180,龙川,中航基金,"中航量化阿尔法六个月持有A,中航量化阿尔法六个月持有C,中航华证商飞高端制造产业指数发起A,中航华证商飞高端制造产业指数发起C,中航恒宇港股通价值优选混合发起A,中航恒宇港股通价值优选混合发起C",2611,2.49,-14.92
1009,1010,30507642,李晨,天弘基金,"天弘现金管家货币C,天弘现金管家货币D,天弘弘运宝货币A,天弘弘运宝货币B,天弘现金管家货币E,天弘中证同业存单AAA指数7天持有,天弘现金管家货币A,天弘现金管家货币B",2632,229.36,21.39
1010,1011,30545614,梁辰,招商基金,"招商研究优选股票A,招商研究优选股票C,招商趋势领航混合A,招商趋势领航混合C",2021,7.47,-2.05
1011,1012,30663469,刘翀,太平基金,太平福安稳健养老一年持有混合(FOF),834,2.36,0.12
