2739,2740,30331589,薛显志,景顺长城基金,"景顺稳健养老目标三年混合(FOF)A,景顺长城颐心养老2040三年持有混合(FOF),景顺长城养老目标日期2035三年持有混合发起(FOF),景顺长城隽丰平衡养老三年持有混合(FOF)A,景顺稳健养老目标三年混合(FOF)Y,景顺长城隽丰平衡养老三年持有混合(FOF)Y",2480,5.18,6.26
2740,2741,30099698,谢屹,诺德基金,"诺德品质消费6个月持有混合,诺德兴新趋势混合A,诺德兴新趋势混合C",3003,3.42,-23.58
2741,2742,30163941,徐彦,大成基金,"大成睿享混合A,大成睿享混合C,大成投资严选六月持有混合A,大成投资严选六月持有混合C,大成致远优势一年持有期混合A,大成致远优势一年持有期混合C,大成弘远回报一年持有混合A,大成弘远回报一年持有混合C,大成策略回报混合C,大成竞争优势混合C,大成策略回报混合A,大成竞争优势混合A",3643,139.07,60.91
2742,2743,30273557,许娅,汇添富基金,"汇添富添富通货币A,汇添富添富通货币B,汇添富中证同业存单AAA指数7天持有期,汇添富理财14天债券A,汇添富理财14天债券B,汇添富添富通货币E",3480,281.72,2.07
2743,2744,30486542,许炎,富国基金,"富国互联科技股票A,富国成长策略混合,富国互联科技股票C,富国核心科技12个月持有混合A,富国核心科技12个月持有混合C,富国时代精选混合A,富国时代精选混合C",2725,63.87,82.62
2744,2745,30405171,许燕,圆信永丰基金,"圆信永丰兴利A,圆信永丰兴利C,圆信永丰兴瑞定开债,圆信永丰兴益三个月定开债,圆信永丰兴利E",2262,42.33,1.34
2745,2746,30662065,邢烨,东海基金,"东海祥利纯债,东海祥苏短债A,东海祥苏短债C,东海祥泰三年定开债发起式,东海鑫享66个月定开,东海启航6个月持有混合A,东海启航6个月持有混合C,东海祥苏短债E,东海鑫宁利率债三个月定开债,东海鑫乐一年定开债发起式",1071,214.49,13.45
2746,2747,30682384,夏雨,工银瑞信基金,"工银战略新兴产业混合A,工银战略新兴产业混合C,工银科技创新6个月定开混合A,工银科技创新6个月定开混合C,工银创业板两年定开混合C,工银创业板两年定开混合A",1607,8.39,31.22
2747,2748,30710801,夏寅,鹏华基金,"鹏华聚财通货币,鹏华盈余宝货币A,鹏华盈余宝货币B,鹏华兴鑫宝货币A,鹏华兴鑫宝货币C,鹏华兴鑫宝货币E,鹏华货币A,鹏华货币B",980,245.33,5.25
2748,2749,30711986,徐一,中银基金,"中银机构现金管理货币A,中银机构现金管理货币E,中银机构现金管理货币C",983,74.66,1.02
2749,2750,30699062,谢越,永赢基金,"永赢增益债券A,永赢增益债券C,永赢宏益债券A,永赢宏益债券C,永赢合益债券,永赢鼎利债券A,永赢鼎利债券C,永赢邦利债券A,永赢邦利债券C,永赢瑞宁87个月定开债,永赢安盈90天滚动持有债券发起A,永赢安盈90天滚动持有债券发起C,永赢坤益债券",1369,238.31,18.34
2750,2751,30699210,熊钰,前海联合,"前海联合润丰混合A,前海联合润丰混合C",1368,0.81,-0.65
2751,2752,30756973,徐越,长城证券,"长城证券中短债A,长城证券中短债C",756,3.3,5.99
2752,2753,30648196,肖彦,上海海通证券资产管理,"海通海升六个月持有债券A,海通海升六个月持有债券C,海通安润90天滚动持有中短债A,海通安润90天滚动持有中短债C",729,8.33,6.52
2753,2754,30762374,邢瑶,中金基金,"中金金选财富进取6个月持有混合(FOF)A,中金金选财富进取6个月持有混合(FOF)C,中金优选长兴稳健6个月持有混合发起(FOF)A,中金优选长兴稳健6个月持有混合发起(FOF)C",644,1.16,-2.38
2754,2755,30555440,夏琰,招商证券资管,"招商资管增益添彩一个月持有期中短债债券D,招商资管增益添彩一个月持有期中短债债券A,招商资管增益添彩一个月持有期中短债债券C",630,0.91,3.64
2755,2756,30780987,薛杨,中加基金,"中加龙头精选混合A,中加龙头精选混合C,中加医疗创新混合发起式A,中加医疗创新混合发起式C",436,0.52,-6.27
2756,2757,30784210,胥艺,博时基金,"博时双月薪定期支付债券,博时富乐纯债债券,博时富鸿金融债3个月定开债A,博时富鸿金融债3个月定开债C,博时安康定开债(LOF)",427,56.82,5.59
2757,2758,30694675,夏宜冰,中银基金,"中银港股通优势成长股票,中银港股通医药混合发起A,中银港股通医药混合发起C,中银全球策略",1408,2.85,61.42
2758,2759,30692552,徐亦达,湘财基金,"湘财长顺混合发起式A,湘财长顺混合发起式C,湘财长源股票型A,湘财长源股票型C,湘财长泽灵活配置混合A,湘财长泽灵活配置混合C,湘财周期轮动一年持有混合,湘财研究精选一年持有期混合A,湘财研究精选一年持有期混合C,湘财鑫享债券A,湘财鑫享债券C,湘财均衡甄选混合A,湘财均衡甄选混合C,湘财医药健康混合A,湘财医药健康混合C",1367,18.68,23.97
2759,2760,30688158,向伊达,银华基金,"银华战略新兴定开混合,银华盛利混合发起式A,银华核心动力精选混合A,银华核心动力精选混合C,银华盛利混合发起式C,银华创新动力优选混合A,银华创新动力优选混合C,银华动力领航混合A,银华动力领航混合C,银华领先策略混合",1521,16.34,32.41
2760,2761,30795902,徐益东,渤海汇金,"渤海汇金优选平衡一年持有混合发起(FOF)A,渤海汇金优选平衡一年持有混合发起(FOF)C,渤海汇金优选稳健6个月持有混合发起(FOF)A,渤海汇金优选稳健6个月持有混合发起(FOF)C",242,0.3,-0.02
2761,2762,30198307,徐艳芳,国金基金,"国金众赢货币,国金及第中短债债券A,国金惠鑫短债债券A,国金惠鑫短债债券C,国金惠鑫短债债券E,国金及第中短债债券B,国金中证同业存单AAA指数7天持有",4001,55.18,28.8
2762,2763,30072180,徐幼华,富国基金,"富国港股通量化精选股票A,富国大盘价值量化精选混合A,富国MSCI中国A股国际通指数增强A,富国中证红利指数增强C,富国中证1000指数增强(LOF)C,富国中证500指数增强(LOF)C,富国港股通量化精选股票C,富国MSCI中国A股国际通指数增强C,富国大盘价值量化精选混合C,富国中证红利指数增强A,富国中证500指数增强(LOF)A,富国中证1000指数增强(LOF)A,富国MSCI中国A50互联互通增强策略ETF",4655,192.92,168.34
2763,2764,30681629,徐一恒,汇添富基金,"汇添富实业债债券A,汇添富实业债债券C,汇添富双鑫添利债券A,汇添富双鑫添利债券C,汇添富稳健收益混合A,汇添富稳健收益混合C,汇添富稳健添盈一年持有混合,汇添富中高等级信用债A,汇添富中高等级信用债C,汇添富中高等级信用债E,汇添富稳健收益混合B",1619,71.9,12.21
2764,2765,30283641,徐喻军,景顺长城基金,"景顺长城量化平衡混合A,景顺长城MSCI中国A股国际通指数增强A,景顺长城中证500指数增强A,景顺长城量化成长演化混合,景顺长城专精特新量化优选股票A,景顺长城专精特新量化优选股票C,景顺长城中证1000指数增强A,景顺长城中证1000指数增强C,景顺长城中证500指数增强C,景顺长城国证2000指数增强A,景顺长城国证2000指数增强C,景顺长城量化平衡混合C,景顺长城MSCI中国A股国际通指数增强C",3583,26.73,16.62
2765,2766,30713929,徐玉良,兴业基金,"兴业聚利灵活配置混合,兴业安保优选混合A,兴业优势产业混合A,兴业优势产业混合C,兴业安保优选混合C",1199,5.67,-15.41
2766,2767,30301089,徐衍鹏,安信基金,安信消费医药股票,512,1.93,-26.03
2767,2768,30727263,谢雨芮,国金基金,"国金惠远纯债A,国金惠远纯债C,国金惠丰39个月定开债,国金中证同业存单AAA指数7天持有,国金中债1-5年政策性金融债A,国金中债1-5年政策性金融债C",1054,86.97,8.09
2768,2769,30476138,夏妍妍,海富通基金,"海富通一年定开债C,海富通安颐收益混合C,海富通全球收益债券美元,海富通聚合纯债,海富通策略收益债券A,海富通策略收益债券C,海富通瑞兴3个月定开债券A,海富通瑞兴3个月定开债券C,海富通全球收益债券人民币,海富通安颐收益混合A,海富通一年定开债A",2226,20.78,23.39
2769,2770,30560735,夏莹莹,南方基金,"南方全天候策略(FOF)A,南方全天候策略(FOF)C,南方合顺多资产(FOF)A,南方合顺多资产(FOF)C,南方浩睿进取京选3个月混合(FOF)A,南方浩睿进取京选3个月混合(FOF)C,南方景气楚荟3个月持有混合(FOF)A,南方景气楚荟3个月持有混合(FOF)C,南方浩盈进取精选一年持有混合(FOF)A,南方浩盈进取精选一年持有混合(FOF)C",2282,26.33,29.49
2770,2771,30301687,徐寅喆,汇添富基金,"汇添富现金宝货币A,汇添富添富通货币A,汇添富全额宝货币A,汇添富和聚宝货币A,汇添富货币C,汇添富货币D,汇添富添富通货币B,汇添富理财60天债券E,汇添富现金宝货币B,汇添富现金宝货币C,汇添富稳利60天短债A,汇添富稳利60天短债C,汇添富货币E,汇添富稳福60天滚动持有中短债A,汇添富稳福60天滚动持有中短债C,汇添富稳福60天滚动持有中短债E,汇添富和聚宝货币C,汇添富稳瑞30天滚动持有中短债A,汇添富稳瑞30天滚动持有中短债C,汇添富稳利60天短债D,汇添富稳福60天滚动持有中短债B,汇添富全额宝货币C,汇添富稳瑞30天滚动持有中短债B,汇添富稳瑞30天滚动持有中短债D,汇添富和聚宝货币B,汇添富和聚宝货币D,汇添富稳益60天持有债券A,汇添富稳益60天持有债券C,汇添富稳利60天短债B,汇添富理财60天债券A,汇添富理财60天债券B,汇添富添富通货币E,汇添富货币B,汇添富货币A,汇添富收益快线货币A,汇添富收益快线货币B",3453,3486.07,30.73
2771,2772,30395963,许一尊,汇添富基金,"汇添富中证500指数增强A,汇添富沪深300指数增强A,汇添富沪深300指数增强C,汇添富中证芯片产业指数增强发起式A,汇添富中证芯片产业指数增强发起式C,汇添富中证细分化工产业主题指数增强发起式A,汇添富中证细分化工产业主题指数增强发起式C,汇添富中证500指数增强C,汇添富中证800指数增强A,汇添富中证800指数增强C,汇添富中证1000指数增强A,汇添富中证1000指数增强C,汇添富稳荣回报债券发起式A,汇添富稳荣回报债券发起式C,汇添富稳元回报债券发起式A,汇添富稳元回报债券发起式C,汇添富稳兴回报债券发起式A,汇添富稳兴回报债券发起式C,汇添富中证500增强策略ETF",2999,79.44,38.18
2772,2773,30724302,熊昱洲,嘉实基金,"嘉实新优选混合,嘉实新能源新材料股票A,嘉实新能源新材料股票C,嘉实产业先锋混合A,嘉实产业先锋混合C,嘉实全球创新龙头股票(QDII)人民币A,嘉实全球创新龙头股票(QDII)美元,嘉实全球创新龙头股票(QDII)人民币C",1109,51.32,-19.78
2773,2774,30790060,许征,易方达基金,"易方达大健康混合,易方达医药生物股票A,易方达医药生物股票C",339,44.78,-6.04
2774,2775,30780316,夏正安,汇添富基金,汇添富科创板2年定开混合,480,14.97,-24.92
2775,2776,30364708,徐治彪,国泰基金,"国泰大健康股票A,国泰研究精选两年持有混合,国泰研究优势混合A,国泰医药健康股票A,国泰大健康股票C,国泰医药健康股票C,国泰研究优势混合C,国泰金鹰增长混合,国泰价值经典混合(LOF)",2969,66.9,62.86
2776,2777,30133472,许智程,弘毅远方基金,"弘毅远方港股通智选领航混合A,弘毅远方港股通智选领航混合C",1096,,-56.56
2777,2778,30758623,须智宸,前海联合,"前海联合智选3个月持有混合(FOF)A,前海联合智选3个月持有混合(FOF)C",724,0.03,-1.29
2778,2779,30062366,谢志华,民生加银基金,"民生加银鑫享债券A,民生加银鑫享债券C,民生加银鹏程混合A,民生加银鹏程混合C,民生加银鑫享债券D,民生加银聚利6个月混合A,民生加银聚利6个月混合C,民生加银月月乐30天持有短债A,民生加银月月乐30天持有短债C,民生加银恒宁债券,民生加银添润债券A,民生加银添润债券C,民生加银恒源债券,民生增强收益债券A,民生增强收益债券C",4483,154.86,3.76
2779,2780,30130650,许忠海,中金基金,"中金成长精选混合A,中金成长精选混合C,中金先进制造混合A,中金先进制造混合C,中金科创主题灵活配置混合(LOF)",3105,4.11,-24.7
2780,2781,30541351,徐张红,招商基金,招商裕华混合,1611,1.96,-22.46
2781,2782,30726135,向志辉,长江证券(上海)资管,"长江长宏混合发起A,长江长宏混合发起C",247,0.53,-2.96
2782,2783,30686601,徐志华,汇添富基金,"汇添富优势行业一年持有混合A,汇添富优势行业一年持有混合C",1355,5.58,-30.06
2783,2784,30199920,夏真辉,国元证券,"国元元赢四个月定开债,国元元赢六个月定开债",834,19.99,10.28
2784,2785,30806540,徐中华,渤海汇金,渤海汇金创新价值一年持有混合,154,0.56,-16.37
2785,2786,30760884,许之捷,汇安基金,"汇安丰融混合A,汇安丰融混合C,汇安消费龙头混合A,汇安消费龙头混合C",687,6.3,-15.49
2786,2787,30444857,谢芝兰,兴证全球基金,"兴全货币B,兴证全球恒惠30天持有超短债A,兴证全球恒惠30天持有超短债C,兴全货币E,兴全货币A",2849,392.36,23.95
2787,2788,30749861,徐智翔,富国基金,"富国新材料新能源混合A,富国长期成长混合A,富国新材料新能源混合C,富国长期成长混合C,富国匠心成长混合A,富国匠心成长混合C,富国天瑞强势混合",827,103.9,-19.3
2788,2789,30044485,许之彦,华安基金,"华安黄金易ETF联接A,华安黄金易ETF联接C,华安沪深300增强A,华安沪深300增强C,华安沪深300ETF联接A,华安沪深300ETF联接C,华安中证电子50ETF发起式联接A,华安中证电子50ETF发起式联接C,华安上证180ETF联接C,华安中国A股增强指数,华安上证180ETF联接A,华安创业板50ETF,华安创业板50ETF联接A,华安创业板50ETF联接C,华安上证180ETF,华安中证电子50ETF,华安沪深300ETF,华安黄金易ETF,华安沪深300增强策略ETF",6308,627.25,75.47
2789,2790,30198031,谢治宇,兴证全球基金,"兴全合宜混合(LOF)C,兴全社会价值三年持有混合,兴全合润混合(LOF),兴全合宜混合(LOF)A",4028,394.2,415.19
2790,2791,30726172,熊哲颖,华安基金,"华安新泰利灵活配置混合A,华安新泰利灵活配置混合C,华安新能源主题混合A,华安新能源主题混合C",821,1.18,-6.4
2791,2792,30044283,杨爱斌,鹏扬基金,"鹏扬汇利债券A,鹏扬汇利债券C,鹏扬泓利债券A,鹏扬泓利债券C,鹏扬聚利六个月持有期债券A,鹏扬聚利六个月持有期债券C,鹏扬景沃六个月持有期混合A,鹏扬景沃六个月持有期混合C,鹏扬景恒六个月持有混合A,鹏扬景恒六个月持有混合C,鹏扬景惠六个月持有期混合A,鹏扬景惠六个月持有期混合C,鹏扬景沣六个月持有期混合A,鹏扬景沣六个月持有期混合C,鹏扬景明一年混合,鹏扬景源一年持有混合A,鹏扬景源一年持有混合C,鹏扬景阳一年持有混合A,鹏扬景阳一年持有混合C",2443,110.73,25.83
2792,2793,30757097,阎安琪,诺德基金,"诺德新能源汽车混合A,诺德新能源汽车混合C",680,0.82,-19.56
2793,2794,30040484,袁蓓,建信基金,"建信鑫安回报灵活配置混合A,建信鑫安回报灵活配置混合C",1781,3.5,-14.94
2794,2795,30283297,余斌,摩根士丹利基金,"大摩量化多策略股票,大摩量化配置混合C,大摩ESG量化混合,大摩多因子策略混合,大摩深证300指数增强,大摩量化配置混合A",3455,11.99,17.48
2795,2796,30675702,于渤,富国基金,"富国新回报灵活配置混合A/B,富国新回报灵活配置混合C,富国新收益灵活配置混合A,富国新收益灵活配置混合C,富国新优享灵活配置混合A,富国新优享灵活配置混合C,富国天润回报混合A,富国天润回报混合C,富国安诚回报12个月持有期混合A,富国安诚回报12个月持有期混合C",1674,23.89,47.74
2796,2797,30729345,于冰,博时基金,"博时新起点混合A,博时新起点混合C,博时鑫源混合A,博时鑫源混合C,博时乐臻定开混合,博时鑫荣稳健混合A,博时鑫荣稳健混合C,博时恒玺一年持有期混合A,博时恒玺一年持有期混合C,博时恒享债券A,博时恒享债券C",1030,4.45,0.96
2797,2798,30615649,于博,易方达基金,易方达科润混合(LOF),787,14.41,-37.72
2798,2799,30781856,杨彬,信达澳亚基金,"信澳安益纯债债券A,信澳安盛纯债,信澳汇鑫两年封闭式债券,信澳安益纯债债券E,信澳安益纯债债券C,信澳鑫安债券(LOF)",462,144.7,5.82
2799,2800,30748952,于渤洋,博时基金,"博时季季享持有期A,博时季季享持有期B,博时裕发纯债,博时聚瑞6个月定开债,博时聚盈纯债债券,博时富益纯债债券,博时广利纯债3个月定开,博时富乾3个月定开债,博时季季享持有期C,博时信用优选债券A,博时信用优选债券C",835,365.06,10.14
2800,2801,30806070,姚波远,建信基金,"建信福泽安泰混合(FOF)A,建信智汇优选一年持有期混合(MOM),建信福泽安泰混合(FOF)C,建信优享进取养老目标五年持有期混合发起(FOF)A,建信优享进取养老目标五年持有期混合发起(FOF)Y",162,14.72,-1.31
2801,2802,30079452,杨成,中银基金,"中银研究精选灵活配置混合A,中银新趋势灵活配置混合A,中银顺宁回报6个月持有混合A,中银顺宁回报6个月持有混合C,中银研究精选灵活配置混合C,中银新趋势灵活配置混合C",4412,3.68,14.64
2802,2803,30299893,杨超,天弘基金,"天弘中证500指数增强A,天弘中证500指数增强C,天弘沪深300指数增强A,天弘沪深300指数增强C,天弘中证高端装备制造增强A,天弘中证高端装备制造增强C,天弘中证新能源指数增强A,天弘中证新能源指数增强C,天弘中证1000指数增强A,天弘中证1000指数增强C,天弘MSCI中国A50互联互通指数A,天弘MSCI中国A50互联互通指数C,天弘创业板指数增强A,天弘创业板指数增强C,天弘国证2000指数增强A,天弘国证2000指数增强C,天弘中证科创创业50ETF,天弘中证1000增强ETF",3263,87.52,41.55
2803,2804,30399610,俞诚,申万菱信基金,"申万菱信中证500指数增强A,申万菱信中证500指数增强C,申万菱信创业板量化精选股票A,申万菱信创业板量化精选股票C",2990,6.03,41.02
2804,2805,30658046,杨超,金信基金,"金信转型创新成长混合发起式A,金信量化精选混合A,金信民旺债券A,金信民旺债券C,金信价值精选混合A,金信价值精选混合C,金信消费升级股票A,金信消费升级股票C,金信核心竞争力混合A,金信景气优选混合A,金信景气优选混合C,金信转型创新成长混合发起式C,金信核心竞争力混合C,金信量化精选混合C",1004,8.12,5.37
2805,2806,30625246,余聪,东莞证券,"东莞德益6个月持有债,东莞德鑫3个月定开债券,东莞证券旗峰天添利货币",948,25.4,12.16
2806,2807,30722523,应琛,鹏华基金,"鹏华永盛一年定开债,鹏华丰康债券A,鹏华永泰定期开放债券,鹏华尊享定开债发起式,鹏华尊晟定期开放发起式债券,鹏华锦利两年定开债,鹏华锦润86个月定开债,鹏华丰康债券C",1133,256.4,12.92
2807,2808,30713596,应超,上海光大证券资产管理,"光大阳光优选一年持有混合A,光大阳光价值30个月混合A,光大阳光稳健增长混合A,光大阳光价值30个月混合B,光大阳光优选一年持有混合B,光大阳光优选一年持有混合C,光大阳光稳健增长混合C",1236,11.61,-1.15
2808,2809,30807376,姚晨飞,农银汇理基金,"农银汇理睿选灵活配置混合,农银策略收益一年持有混合",139,34.17,1.93
2809,2810,30794342,于成琨,中加基金,"中加心悦混合A,中加心悦混合C,中加聚优一年定开混合A,中加聚优一年定开混合C",288,1.75,-1.81
2810,2811,30282411,叶朝明,鹏华基金,"鹏华增值宝货币,鹏华安盈宝货币A,鹏华添利宝货币A,鹏华弘安混合A,鹏华弘安混合C,鹏华添利交易型货币A,鹏华盈余宝货币A,鹏华盈余宝货币B,鹏华金元宝货币,鹏华稳利短债A,鹏华浮动净值型发起式货币,鹏华稳利短债C,鹏华0-5年利率发起式债券A,鹏华中债3-5年国开债指数A,鹏华中债3-5年国开债指数C,鹏华中债1-3年农发行债券指数A,鹏华中债1-3年农发行债券指数C,鹏华添利宝货币B,鹏华稳泰30天滚动持有债券A,鹏华稳泰30天滚动持有债券C,鹏华稳华90天滚动持有债券A,鹏华稳华90天滚动持有债券C,鹏华中证同业存单AAA指数7天持有,鹏华稳瑞中短债,鹏华稳福中短债债券A,鹏华稳福中短债债券C,鹏华稳福中短债债券E,鹏华安盈宝货币C,鹏华安盈宝货币E,鹏华0-5年利率发起式债券C,鹏华0-4年地方政府债ETF,鹏华中证5年地债ETF,鹏华添利交易型货币B",3633,4082.98,33.3
2811,2812,30339881,姚晨曦,中海基金,"中海信息产业混合A,中海新兴成长六个月持有期混合,中海消费混合C,中海信息产业混合C,中海能源策略混合,中海环保新能源混合,中海消费混合A",3220,28.3,23.01
2812,2813,30055498,杨冬,广发基金,"广发东财大数据精选混合A,广发多因子混合,广发稳健策略混合,广发东财大数据精选混合C,广发价值领航一年持有混合A,广发价值领航一年持有混合C,广发瑞誉一年持有期混合A,广发瑞誉一年持有期混合C",952,145.98,-3.15
2813,2814,30364521,杨栋,富国基金,"富国低碳新经济混合A,富国清洁能源产业混合A,富国积极成长一年定开混合,富国均衡优选混合,富国成长领航混合,富国清洁能源产业混合C,富国低碳新经济混合C,富国创新发展两年定开混合A,富国创新发展两年定开混合C,富国融悦12个月持有期混合A,富国融悦12个月持有期混合C",3097,122.91,109.11
2814,2815,30534285,闫冬,鹏华基金,"鹏华内地低碳联接A,鹏华内地低碳联接C,鹏华资源C,鹏华中证沪港深科技龙头指数(LOF)C,鹏华国证钢铁行业指数(LOF)C,鹏华中证细分化工产业主题ETF联接A,鹏华中证细分化工产业主题ETF联接C,鹏华中证800地产指数(LOF)C,鹏华中证环保产业指数(LOF)C,鹏华国证石油天然气ETF,鹏华中证光伏产业ETF,鹏华中证细分化工产业ETF,鹏华国证有色金属行业ETF,鹏华中证内地低碳经济主题ETF,鹏华资源A,鹏华中证800地产指数(LOF)A,鹏华中证环保产业指数(LOF)A,鹏华中证沪港深科技龙头指数(LOF)A,鹏华国证钢铁行业指数(LOF)A",1788,46.68,69.49
2815,2816,30699886,杨栋,贝莱德基金,"贝莱德港股通远景视野混合A,贝莱德港股通远景视野混合C",703,2.39,-32.58
2816,2817,30069144,杨定光,广发基金,广发创新驱动灵活配置混合,1275,1.42,-15.86
2817,2818,30061686,杨德龙,前海开源基金,"前海开源清洁能源混合A,前海开源清洁能源混合C,前海开源沪港深龙头精选混合,前海开源沪港深聚瑞混合,前海开源深圳特区精选股票A,前海开源深圳特区精选股票C,前海开源优质龙头6个月持有混合A,前海开源优质龙头6个月持有混合C",3709,19.94,-25.39
2818,2819,30708652,袁多武,九泰基金,"九泰聚鑫混合A,九泰聚鑫混合C,九泰久慧混合A,九泰久慧混合C,九泰锐富事件驱动混合发起式(LOF)C,九泰锐富事件驱动混合发起式(LOF)A",1295,2.16,1.58
2819,2820,30742695,杨达伟,浦银安盛基金,"浦银安盛环保新能源A,浦银安盛环保新能源C,浦银安盛品质优选混合A,浦银安盛品质优选混合C",897,12.69,-48.18
2820,2821,30795642,雍大为,嘉实基金,嘉实事件驱动股票,136,8.36,-9.64
2821,2822,30037860,严菲,中银基金,"中银美丽中国混合,中银健康生活混合,中银宏观策略混合A,中银宏观策略混合C",5973,3.83,56.87
2822,2823,30301316,杨飞,鹏华基金,"鹏华创新驱动混合,鹏华高端装备一年持有期混合A,鹏华高端装备一年持有期混合C",3261,3.96,-15.79
2823,2824,30500709,杨枫,国投瑞银基金,"国投瑞银瑞祥A,国投瑞银瑞祥C,国投瑞银瑞泰多策略混合C,国投瑞银顺成3个月定开债,国投瑞银融华债券,国投瑞银优化增强债券A/B,国投瑞银优化增强债券C,国投瑞银瑞泰多策略混合A",954,135.76,9.11
2824,2825,30543573,杨凡,金鹰基金,"金鹰智慧生活混合A,金鹰转型动力混合,金鹰智慧生活混合C",1774,0.69,1.81
2825,2826,30753599,叶峰,兴证全球基金,"兴证全球品质甄选混合A,兴证全球品质甄选混合C,兴全合润混合(LOF)",781,232.44,-8.25
2826,2827,30798550,叶丰,华泰柏瑞基金,"华泰柏瑞致远混合A,华泰柏瑞致远混合C",242,1.37,-19.6
2827,2828,30804044,袁锋,汇添富基金,"汇添富中盘潜力增长一年持有混合A,汇添富中盘潜力增长一年持有混合C",186,0.74,-16.34
2828,2829,30458700,易芳菲,中银基金,"中银中高等级A,中银机构现金管理货币A,中银季季红定开债,中银丰润定期开放债券,中银中高等级C,中银丰进定期开放债券,中银弘享债券A,中银福建国企债定开债A,中银福建国企债定开债C,中银淳享一年定开债券发起式,中银机构现金管理货币E,中银鑫盛一年持有债券A,中银鑫盛一年持有债券C,中银机构现金管理货币C,中银弘享债券B",2816,344.66,30.41
2829,2830,30195116,姚飞军,招商基金,"招商增浩一年定期开放混合A,招商增浩一年定期开放混合C,招商增荣混合(LOF)",2807,1.28,37.3
